{
  "artifacts": [
    {
      "artifact_type": "authority_decision",
      "digest": "sha256:a82f7f15d2f48e464590e17e976ed0f2da50690cf4bb0998b59a73749e050e1e",
      "digest_mode": "tiber-canonical-json-v1",
      "path": "authority/keenan-allen-ind-signing-v0-activation.json"
    },
    {
      "artifact_type": "activation",
      "digest": "sha256:7615eeecafc4bd1c2aaea89bfb44513b08751a6c0fb09b2a4d47f847a8641d30",
      "digest_mode": "tiber-canonical-json-v1",
      "path": "runs/keenan-allen-ind-signing-v0/activation.json"
    },
    {
      "artifact_type": "inputs",
      "digest": "sha256:8dc64b58d70632269456be4a5ccb2b9508d6860b54bc658e57d3081a1a371ce7",
      "digest_mode": "tiber-canonical-json-v1",
      "path": "runs/keenan-allen-ind-signing-v0/inputs.json"
    },
    {
      "artifact_type": "job",
      "digest": "sha256:076648700709e2bd50d00a15c758d08d2d5c43a892d657724bbc46145c707d42",
      "digest_mode": "tiber-raw-sha256-v1",
      "path": "preflight/keenan-allen-ind-signing-v0/candidate/job.yaml"
    },
    {
      "artifact_type": "ledger",
      "digest": "sha256:3f9af98c289caf96b83fc51f73f03358586efad1611b09c11c5a2ad9c7659858",
      "digest_mode": "tiber-raw-sha256-v1",
      "path": "runs/keenan-allen-ind-signing-v0/attempts/attempt-001/ledger.jsonl"
    },
    {
      "artifact_type": "packet_json",
      "digest": "sha256:d80430f5195eaa9617d6122efff88d35c950f62daff5d375c38070f5d92aee95",
      "digest_mode": "tiber-canonical-json-v1",
      "path": "runs/keenan-allen-ind-signing-v0/attempts/attempt-001/packet.json"
    },
    {
      "artifact_type": "packet_markdown",
      "digest": "sha256:3e96e900883e98991669215f3077d5581b0eb4fc489646fcd99fdd5d285455b0",
      "digest_mode": "tiber-raw-sha256-v1",
      "path": "runs/keenan-allen-ind-signing-v0/attempts/attempt-001/packet.md"
    }
  ],
  "attempt_id": "attempt-001",
  "canonicalization_version": "tiber-canonical-json-v1",
  "executor_session": {
    "actor_session_ref": "claude-executor-lane",
    "model_declared": "model-identity-withheld-by-harness-policy",
    "observed_by": "operator-session-joseph-prometheus-frameworks",
    "provider_declared": "anthropic",
    "role": "executor"
  },
  "job_id": "keenan-allen-ind-signing",
  "job_version": "v1",
  "json_file_version": "tiber-json-file-v1",
  "ledger_head": {
    "event_count": 15,
    "event_hash": "sha256:4f31e4d716a617d722015ed8629f8fdaf971b5efba71eb354bc601fe0e5ffdb7",
    "event_id": "event-015-checkpoint-final"
  },
  "raw_hash_version": "tiber-raw-sha256-v1",
  "renderer_version": "tiber-packet-markdown-v1",
  "run_id": "keenan-allen-ind-signing-v0",
  "schema_version": "research-submission/v0",
  "sources": [
    {
      "content": {
        "artifact_type": "source_content",
        "digest": "sha256:a21e90e102f90c5f0b7bf771ea9f66af7625f388b651c781457cf195d079aa7b",
        "digest_mode": "tiber-raw-sha256-v1",
        "path": "runs/keenan-allen-ind-signing-v0/sources/src-pfr-allen-colts-signing/excerpts.txt"
      },
      "metadata": {
        "artifact_type": "source_metadata",
        "digest": "sha256:00dcca054022bc8c0bdbfdea4974a30190c1ad2834c980350d637814588b4df2",
        "digest_mode": "tiber-canonical-json-v1",
        "path": "runs/keenan-allen-ind-signing-v0/sources/src-pfr-allen-colts-signing/metadata.json"
      },
      "source_object_id": "src-pfr-allen-colts-signing"
    },
    {
      "content": {
        "artifact_type": "source_content",
        "digest": "sha256:0430fd9213894171a143cd0a7f737c3003b9cada1effcf9b901fc70c7eaa8644",
        "digest_mode": "tiber-raw-sha256-v1",
        "path": "runs/keenan-allen-ind-signing-v0/sources/src-foxsports-allen-colts-signing/excerpts.txt"
      },
      "metadata": {
        "artifact_type": "source_metadata",
        "digest": "sha256:041aff354a8372bea0f9e58c48b14668254415a76e7f71a27b361e766327ebaa",
        "digest_mode": "tiber-canonical-json-v1",
        "path": "runs/keenan-allen-ind-signing-v0/sources/src-foxsports-allen-colts-signing/metadata.json"
      },
      "source_object_id": "src-foxsports-allen-colts-signing"
    },
    {
      "content": {
        "artifact_type": "source_content",
        "digest": "sha256:d846465459dd8349aaf2f5afa34175802d9df37188916d04192d6e62a4e1f1ea",
        "digest_mode": "tiber-raw-sha256-v1",
        "path": "runs/keenan-allen-ind-signing-v0/sources/src-larrybrown-allen-colts-signing/excerpts.txt"
      },
      "metadata": {
        "artifact_type": "source_metadata",
        "digest": "sha256:cb6704caeae4962ec31eac042499a90ec45d23e2f4cd84aedd77a32e34bc3ea9",
        "digest_mode": "tiber-canonical-json-v1",
        "path": "runs/keenan-allen-ind-signing-v0/sources/src-larrybrown-allen-colts-signing/metadata.json"
      },
      "source_object_id": "src-larrybrown-allen-colts-signing"
    },
    {
      "content": null,
      "metadata": {
        "artifact_type": "source_metadata",
        "digest": "sha256:c723f06f73f6ec0dce99616dc05cc75e4cb532a12bdabc45afbafefd56d0689e",
        "digest_mode": "tiber-canonical-json-v1",
        "path": "runs/keenan-allen-ind-signing-v0/sources/src-tiber-data-population-census/metadata.json"
      },
      "source_object_id": "src-tiber-data-population-census"
    },
    {
      "content": null,
      "metadata": {
        "artifact_type": "source_metadata",
        "digest": "sha256:1f7b64222bbba248be4a588c4db255dc7fcd5a1e5c2eea5f4eae654d720f1de9",
        "digest_mode": "tiber-canonical-json-v1",
        "path": "runs/keenan-allen-ind-signing-v0/sources/src-tiber-data-identity-crosswalk-v2/metadata.json"
      },
      "source_object_id": "src-tiber-data-identity-crosswalk-v2"
    },
    {
      "content": null,
      "metadata": {
        "artifact_type": "source_metadata",
        "digest": "sha256:7ac8a94b122e0a41fcc2957c3b938042b623387d79f85658e6766f228d848fda",
        "digest_mode": "tiber-canonical-json-v1",
        "path": "runs/keenan-allen-ind-signing-v0/sources/src-tiber-data-ownership-events-2026/metadata.json"
      },
      "source_object_id": "src-tiber-data-ownership-events-2026"
    },
    {
      "content": null,
      "metadata": {
        "artifact_type": "source_metadata",
        "digest": "sha256:d1b23f5fda82c11b575a5f57e1a8def512e026d62f39acc5d9534004d730b34c",
        "digest_mode": "tiber-canonical-json-v1",
        "path": "runs/keenan-allen-ind-signing-v0/sources/src-tiber-data-ownership-change-contract/metadata.json"
      },
      "source_object_id": "src-tiber-data-ownership-change-contract"
    },
    {
      "content": null,
      "metadata": {
        "artifact_type": "source_metadata",
        "digest": "sha256:ea8ce12691619ddb914386b5418a4a04f91fc39ec5f69e7e0a9055a4841a00a7",
        "digest_mode": "tiber-canonical-json-v1",
        "path": "runs/keenan-allen-ind-signing-v0/sources/src-tiber-data-current-player-state-audit/metadata.json"
      },
      "source_object_id": "src-tiber-data-current-player-state-audit"
    }
  ],
  "submitted_at": "2026-08-18T21:45:00Z",
  "synthetic_fixture": false,
  "validation": {
    "result": "pass",
    "validated_at": "2026-08-18T21:45:00Z"
  },
  "validator_version": "tiber-research-validator-v0"
}
